{
  "selectionVersion": "1",
  "selectionId": "dpp-release-2026-09-3",
  "purpose": "The claims the third September 2026 candidate set requires of the ledger before its packages are published: the native baselines, the reference operator with its complete export, the registry, the custody and interoperability profiles this repository implements and tests. Every claim that names a standard this repository has not mapped, an operation it has not demonstrated or a product it has not qualified is withheld by name.",
  "releaseSet": "dpp-release-2026-09-3",
  "claims": [
    { "id": "passport-reader-native-baseline-1", "kind": "component", "disposition": "required" },
    { "id": "passport-reader-native-baseline-2", "kind": "component", "disposition": "required" },
    { "id": "attestation-verifier-native-baseline-1", "kind": "component", "disposition": "required" },
    { "id": "passport-writer-reference-example", "kind": "component", "disposition": "required" },
    { "id": "overlay-single-operator-1", "kind": "component", "disposition": "required" },
    { "id": "registry-current-intake", "kind": "component", "disposition": "required" },
    { "id": "authenticated-status-service", "kind": "component", "disposition": "required" },
    { "id": "vsc-draft-compat-0.1.0-implemented-subset", "kind": "draft-compatibility", "disposition": "required" },
    { "id": "profile-governance", "kind": "component", "disposition": "required" },
    { "id": "gs1-identifier-discipline", "kind": "component", "disposition": "required" },
    { "id": "exchange-profiles-groundwork", "kind": "component", "disposition": "required" },
    { "id": "managed-custody-1", "kind": "component", "disposition": "required" },
    { "id": "managed-custody-1-writer", "kind": "component", "disposition": "required" },
    { "id": "gs1-discovery-1", "kind": "component", "disposition": "required" },
    { "id": "epcis-source-exchange-1", "kind": "component", "disposition": "required" },
    { "id": "external-credential-ecdsa-1", "kind": "component", "disposition": "required" },
    { "id": "passport-projection-1", "kind": "component", "disposition": "required" },
    { "id": "overlay-federated-operators-1", "kind": "operation", "disposition": "withheld", "rationale": "Two processes under one administration prove the synchronisation mechanism and never independence; EXPORT-3-durable-publication is a gap until separately administered operators exercise replication and recovery." },
    { "id": "vsc-draft-compat-0.1.0-full", "kind": "draft-compatibility", "disposition": "withheld", "rationale": "The upstream context and executable suite are unavailable at the pinned revision; only the implemented subset is claimed." },
    { "id": "untp-0.7.0-pilot", "kind": "component", "disposition": "withheld", "rationale": "The UNTP schemas and contexts are not pinned and the application pilot validates nothing against them; the profile remains proposed." },
    { "id": "eu-dpp-system-conformance", "kind": "system", "disposition": "withheld", "rationale": "No normative EN text has been read; every EN row is unassessed or a gap, and the release set makes no European conformity statement. The selection eu-dpp-system-2026-09 is the gate for that claim." },
    { "id": "eu-dpp-draft-security-integrity-compatibility", "kind": "draft-compatibility", "disposition": "withheld", "rationale": "prEN 18239:2025 and prEN 18246:2025 are drafts whose text has not been read; nothing is claimed against them." },
    { "id": "battery-passport-qualification", "kind": "product", "disposition": "withheld", "rationale": "battery@3 is a draft profile; the Annex XIII mapping is unassessed and product-data compliance is a separate qualification from this release." },
    { "id": "version-1-0-readiness", "kind": "governance", "disposition": "withheld", "rationale": "No implementation by another implementing party has passed every fixture; the programme-authored Python reader is engineering evidence, not independence." }
  ],
  "exclusions": [],
  "reviewedAt": "2026-09-06",
  "reviewOwner": "dpp maintainers",
  "notes": "The qualification of this selection says which claims the ledger's evidence supports for the packages of the candidate set. It is not a statement about the deployed index, the registry runtime, the application, product compliance or any European standard."
}
